Nro.,SEDE DEPARTAMENTAL,SUBSEDE DEPARTAMENTAL,PERSONAL A CONTRATAR,PERSONAL A CAPACITAR
1,AMAZONAS,"CHACHAPOYAS: (PROVINCIA CHACHAPOYAS: CHACHAPOYAS, ASUNCION, BALSAS, CHETO, CHILIQUIN, CHUQUIBAMBA, GRANADA, HUANCAS, LA JALCA, LEIMEBAMBA, LEVANTO, MAGDALENA, MARISCAL CASTILLA, MOLINOPAMPA, MONTEVIDEO, OLLEROS, QUINJALCA, SAN FRANCISCO DE DAGUAS, SAN ISIDRO DE MAINO, SOLOCO, SONCHE / PROVINCIA LUYA: LAMUD, COCABAMBA, COLCAMAR, CONILA, INGUILPATA, LONGUITA, LONYA CHICO, LUYA, LUYA VIEJO, MARIA, OCUMAL, PISUQUIA, PROVIDENCIA, SAN CRISTOBAL, SAN FRANCISCO DEL YESO, SAN JERONIMO, SAN JUAN DE LOPECANCHA, SANTA CATALINA, SANTO TOMAS, TINGO, TRITA )",120,156
2,AMAZONAS,"BAGUA: ( PROVINCIA BAGUA: BAGUA, ARAMANGO, COPALLIN, EL PARCO, IMAZA, LA PECA )",80,104
3,AMAZONAS,"BONGARA: (PROVINCIA BONGARA: JAZAN, JUMBILLA, CHISQUILLA, CHURUJA, COROSHA, CUISPES, FLORIDA, RECTA, SAN CARLOS, SHIPASBAMBA, VALERA, YAMBRASBAMBA )",32,42
4,AMAZONAS,"CONDORCANQUI: (PROVINCIA CONDORCANQUI: NIEVA, EL CENEPA, RIO SANTIAGO )",80,104
5,AMAZONAS,"RODRIGUEZ DE MENDOZA: ( PROVINCIA RODRIGUEZ DE MENDOZA: SAN NICOLAS, CHIRIMOTO, COCHAMAL, HUAMBO, LIMABAMBA, LONGAR, MARISCAL BENAVIDES, MILPUC, OMIA, SANTA ROSA, TOTORA )",40,52
6,AMAZONAS,"UTCUBAMBA: (PROVINCIA UTCUBAMBA: BAGUA GRANDE, CAJARURO, CUMBA, EL MILAGRO, JAMALCA, LONYA GRANDE, YAMON / PROVINCIA LUYA: CAMPORREDONDO, OCALLI)",138,180
7,ANCASH - CHIMBOTE,"SANTA 1: (PROVINCIA SANTA: CHIMBOTE, MACATE )",140,182
8,ANCASH - CHIMBOTE,"CASMA: (PROVINCIA CASMA: CASMA, BUENA VISTA ALTA, COMANDANTE NOEL, YAUTAN / PROVINCIA YUNGAY: QUILLO)",76,99
9,ANCASH - CHIMBOTE,"HUARMEY: (PROVINCIA HUARMEY: HUARMEY, COCHAPETI, CULEBRAS, HUAYAN, MALVAS / PROVINCIA HUARAZ: HUANCHAY)",42,55
10,ANCASH - CHIMBOTE,"PALLASCA: (PROVINCIA PALLASCA: CABANA, BOLOGNESI, CONCHUCOS, HUACASCHUQUE, HUANDOVAL, LACABAMBA, LLAPO, PALLASCA, PAMPAS, SANTA ROSA, TAUCA )",34,44
11,ANCASH - CHIMBOTE,"SANTA 2: (PROVINCIA SANTA: SANTA, COISHCO )",30,39
12,ANCASH - CHIMBOTE,"SANTA 3: (PROVINCIA SANTA: NUEVO CHIMBOTE, CACERES DEL PERU, MORO, NEPEÑA, SAMANCO)",176,229
13,ANCASH - HUARAZ,"HUARAZ: (PROVINCIA HUARAZ: HUARAZ, COCHABAMBA, COLCABAMBA, INDEPENDENCIA, JANGAS, LA LIBERTAD, OLLEROS, PAMPAS GRANDE, PARIACOTO, PIRA, TARICA)",160,208
14,ANCASH - HUARAZ,"ANTONIO RAYMONDI: (PROVINCIA ANTONIO RAYMONDI: LLAMELLIN, ACZO, CHACCHO, CHINGAS, MIRGAS, SAN JUAN DE RONTOY / PROVINCIA HUARI: HUACCHIS, PAUCAS, RAPAYAN, UCO )",30,39
15,ANCASH - HUARAZ,"BOLOGNESI: (PROVINCIA BOLOGNESI: CHIQUIAN, ABELARDO PARDO LEZAMETA, ANTONIO RAYMONDI, AQUIA, CAJACAY, CANIS, COLQUIOC, HUALLANCA, HUASTA, HUAYLLACAYAN, LA PRIMAVERA, MANGAS, PACLLON, SAN MIGUEL DE CORPANQUI, TICLLOS / PROVINCIA OCROS: OCROS, ACAS, CAJAMARQUILLA, CONGAS, LLIPA, SAN CRISTOBAL DE RAJAN, SAN PEDRO, SANTIAGO DE CHILCAS )",49,64
16,ANCASH - HUARAZ,"CARHUAZ: (PROVINCIA CARHUAZ: CARHUAZ, ACOPAMPA, AMASHCA, ANTA, ATAQUERO, MARCARA, PARIAHUANCA, SAN MIGUEL DE ACO, SHILLA, TINCO, YUNGAR / PROVINCIA ASUNCION: CHACAS, ACOCHACA / PROVINCIA CARLOS FERMIN FITZCARRALD: SAN LUIS, SAN NICOLAS, YAUYA)",102,133
17,ANCASH - HUARAZ,"HUARI: (PROVINCIA HUARI: SAN MARCOS, HUARI, ANRA, CAJAY, CHAVIN DE HUANTAR, HUACACHI, HUACHIS, HUANTAR, MASIN, PONTO, RAHUAPAMPA, SAN PEDRO DE CHANA )",70,91
18,ANCASH - HUARAZ,"HUAYLAS: (PROVINCIA HUAYLAS: CARAZ, HUALLANCA, HUATA, HUAYLAS, MATO, PAMPAROMAS, PUEBLO LIBRE, SANTA CRUZ, SANTO TORIBIO, YURACMARCA )",70,91
19,ANCASH - HUARAZ,"MARISCAL LUZURIAGA: (PROVINCIA MARISCAL LUZURIAGA: PISCOBAMBA, CASCA, ELEAZAR GUZMAN BARRON, FIDEL OLIVAS ESCUDERO, LLAMA, LLUMPA, LUCMA, MUSGA )",34,44
20,ANCASH - HUARAZ,"RECUAY: (PROVINCIA RECUAY: RECUAY, CATAC, COTAPARACO, HUAYLLAPAMPA, LLACLLIN, MARCA, PAMPAS CHICO, PARARIN, TAPACOCHA, TICAPAMPA / PROVINCIA AIJA: AIJA, CORIS, HUACLLAN, LA MERCED, SUCCHA)",36,47
21,ANCASH - HUARAZ,"SIHUAS: (SIHUAS, ACOBAMBA, ALFONSO UGARTE, CASHAPAMPA, CHINGALPO, HUAYLLABAMBA, QUICHES, RAGASH, SAN JUAN, SICSIBAMBA / PROVINCIA CORONGO: CORONGO, ACO, BAMBAS, CUSCA, LA PAMPA, YANAC, YUPAN / PROVINCIA POMABAMBA: POMABAMBA, HUAYLLAN, PAROBAMBA, QUINUABAMBA)",90,117
22,ANCASH - HUARAZ,"YUNGAY: (PROVINCIA YUNGAY: YUNGAY, CASCAPARA, MANCOS, MATACOTO, RANRAHIRCA, SHUPLUY, YANAMA )",60,78
23,APURIMAC,"ABANCAY: (PROVINCIA ABANCAY: ABANCAY, CHACOCHE, CIRCA, CURAHUASI, HUANIPACA, LAMBRAMA, PICHIRHUA, SAN PEDRO DE CACHORA, TAMBURCO )",128,167
24,APURIMAC,"ANDAHUAYLAS: (PROVINCIA ANDAHUAYLAS: ANDAHUAYLAS, ANDARAPA, CHIARA, HUANCARAMA, HUANCARAY, HUAYANA, KISHUARA, PACOBAMBA, PACUCHA, PAMPACHIRI, POMACOCHA, SAN ANTONIO DE CACHI, SAN JERONIMO, SAN MIGUEL DE CHACCRAMPA, SANTA MARIA DE CHICMO, TALAVERA, TUMAY HUARACA, TURPO, KAQUIABAMBA, JOSE MARIA ARGUEDAS )",176,229
25,APURIMAC,"AYMARAES: (PROVINCIA AYMARAES: CHALHUANCA, CAPAYA, CARAYBAMBA, CHAPIMARCA, COLCABAMBA, COTARUSE, HUAYLLO, JUSTO APU SAHUARAURA, LUCRE, POCOHUANCA, SAN JUAN DE CHACÑA, SAÑAYCA, SORAYA, TAPAIRIHUA, TINTAY, TORAYA, YANACA / PROVINCIA ANTABAMBA: ANTABAMBA, EL ORO, HUAQUIRCA, JUAN ESPINOZA MEDRANO, OROPESA, PACHACONAS, SABAINO / PROVINCIA GRAU: MAMARA, TURPAY)",80,104
26,APURIMAC,"CHINCHEROS: (PROVINCIA CHINCHEROS: ANCO_HUALLO, CHINCHEROS, COCHARCAS, HUACCANA, OCOBAMBA, ONGOY, URANMARCA, RANRACANCHA, ROCCHACC, EL PORVENIR, LOS CHANKAS, AHUAYRO )",72,94
27,APURIMAC,"COTABAMBAS: (PROVINCIA COTABAMBAS: TAMBOBAMBA, COTABAMBAS, COYLLURQUI, HAQUIRA, MARA, CHALLHUAHUACHO / PROVINCIA GRAU: GAMARRA)",94,122
28,APURIMAC,"GRAU: (PROVINCIA GRAU: CHUQUIBAMBILLA, CURPAHUASI, HUAYLLATI, MICAELA BASTIDAS, PATAYPAMPA, PROGRESO, SAN ANTONIO, SANTA ROSA, VILCABAMBA, VIRUNDO, CURASCO)",28,37
29,AREQUIPA,"AREQUIPA 1: (PROVINCIA AREQUIPA: AREQUIPA, YANAHUARA)",56,73
30,AREQUIPA,AREQUIPA 2: (PROVINCIA AREQUIPA: ALTO SELVA ALEGRE),64,84
31,AREQUIPA,"AREQUIPA 3: (PROVINCIA AREQUIPA: MARIANO MELGAR, MIRAFLORES / PROVINCIA CAYLLOMA: SAN ANTONIO DE CHUCA / PROVINCIA CONDESUYOS: CAYARANI)",100,130
32,AREQUIPA,"AREQUIPA 4: (PROVINCIA AREQUIPA: PAUCARPATA, CHIGUATA, SAN JUAN DE TARUCANI)",98,128
33,AREQUIPA,"AREQUIPA 5: (PROVINCIA AREQUIPA: JOSE LUIS BUSTAMANTE Y RIVERO, CHARACATO, SABANDIA )",72,94
34,AREQUIPA,"AREQUIPA 6: (PROVINCIA AREQUIPA: SOCABAYA, MOLLEBAYA, POCSI, POLOBAYA, QUEQUEÑA, YARABAMBA )",84,110
35,AREQUIPA,"AREQUIPA 7: (PROVINCIA AREQUIPA: JACOBO HUNTER, SACHACA, TIABAYA, UCHUMAYO )",76,99
36,AREQUIPA,"AREQUIPA 8: (PROVINCIA AREQUIPA: LA JOYA, SAN JUAN DE SIGUAS, SANTA ISABEL DE SIGUAS, SANTA RITA DE SIGUAS, VITOR )",84,110
37,AREQUIPA,"AREQUIPA 9: (PROVINCIA AREQUIPA: YURA / PROVINCIA CAYLLOMA: HUANCA, LLUTA )",96,125
38,AREQUIPA,AREQUIPA 10: (PROVINCIA AREQUIPA: CAYMA),74,96
39,AREQUIPA,AREQUIPA 11: (PROVINCIA AREQUIPA: CERRO COLORADO),172,224
40,AREQUIPA,"CAMANA: (PROVINCIA CAMANA: CAMANA, JOSE MARIA QUIMPER, MARIANO NICOLAS VALCARCEL, MARISCAL CACERES, NICOLAS DE PIEROLA, OCOÑA, QUILCA, SAMUEL PASTOR / PROVINCIA CONDESUYOS: RIO GRANDE )",76,99
41,AREQUIPA,"CARAVELI: (PROVINCIA CARAVELI: CHALA, CARAVELI, ACARI, ATICO, ATIQUIPA, BELLA UNION, CAHUACHO, CHAPARRA, HUANUHUANU, JAQUI, LOMAS, QUICACHA, YAUCA )",60,78
42,AREQUIPA,"CASTILLA: (PROVINCIA CASTILLA: APLAO, ANDAGUA, AYO, CHACHAS, CHILCAYMARCA, HUANCARQUI, MACHAGUAY, ORCOPAMPA, PAMPACOLCA, TIPAN, UÑON, URACA, VIRACO / PROVINCIA CONDESUYOS: CHUQUIBAMBA, ANDARAY, CHICHAS, IRAY, SALAMANCA, YANAQUIHUA )",64,84
43,AREQUIPA,"CAYLLOMA: (PROVINCIA CAYLLOMA: MAJES, CHIVAY, ACHOMA, CABANACONDE, CALLALLI, CAYLLOMA, COPORAQUE, HUAMBO, ICHUPAMPA, LARI, MACA, MADRIGAL, SIBAYO, TAPAY, TISCO, TUTI, YANQUE / PROVINCIA CASTILLA: CHOCO )",152,198
44,AREQUIPA,"ISLAY: (PROVINCIA ISLAY: MOLLENDO, COCACHACRA, DEAN VALDIVIA, ISLAY, MEJIA, PUNTA DE BOMBON )",58,76
45,AREQUIPA,"LA UNION: (PROVINCIA LA UNION: COTAHUASI, ALCA, CHARCANA, HUAYNACOTAS, PAMPAMARCA, PUYCA, QUECHUALLA, SAYLA, TAURIA, TOMEPAMPA, TORO )",28,37
46,AYACUCHO,"HUAMANGA 1: ( PROVINCIA HUAMANGA: AYACUCHO, SAN JOSE DE TICLLAS, SANTIAGO DE PISCHA, SOCOS, VINCHOS / PROVINCIA VICTOR FAJARDO: VILCANCHOS /PROVINCIA CANGALLO: PARAS, TOTOS )",140,182
47,AYACUCHO,"CANGALLO: (PROVINCIA CANGALLO: CANGALLO, CHUSCHI, LOS MOROCHUCOS, MARIA PARADO DE BELLIDO / PROVINCIA VICTOR FAJARDO: HUANCAPI, ALCAMENCA, APONGO, ASQUIPATA, CANARIA, CAYARA, COLCA, HUAMANQUIQUIA, HUANCARAYLLA, HUAYA, SARHUA )",84,110
48,AYACUCHO,"HUAMANGA 2: (PROVINCIA HUAMANGA: SAN JUAN BAUTISTA, PACAYCASA, QUINUA, JESUS NAZARENO, ANDRES AVELINO CACERES DORREGARAY )",92,120
49,AYACUCHO,"HUAMANGA 3: (PROVINCIA HUAMANGA: CARMEN ALTO, ACOCRO, ACOS VINCHOS, CHIARA, OCROS, TAMBILLO )",80,104
50,AYACUCHO,"HUANTA: (PROVINCIA HUANTA: HUANTA, AYAHUANCO, HUAMANGUILLA, IGUAIN, LURICOCHA, SANTILLANA, SIVIA, LLOCHEGUA, CANAYRE, UCHURACCAY, PUCACOLPA, CHACA, PUTIS )",140,182
51,AYACUCHO,"LA MAR: (PROVINCIA LA MAR: SAN MIGUEL, ANCO, AYNA, CHILCAS, CHUNGUI, LUIS CARRANZA, SANTA ROSA, TAMBO, SAMUGARI, ANCHIHUAY, ORONCCOY, UNION PROGRESO, RIO MAGDALENA, NINABAMBA, PATIBAMBA )",108,141
52,AYACUCHO,"LUCANAS: (PROVINCIA LUCANAS: PUQUIO, AUCARA, CABANA, CARMEN SALCEDO, CHAVIÑA, CHIPAO, LUCANAS, SAISA, SAN CRISTOBAL, SAN JUAN, SAN PEDRO, SANCOS, SANTA ANA DE HUAYCAHUACHO, SANTA LUCIA /PROVINCIA HUANCA SANCOS: SANCOS, CARAPO, SACSAMARCA, SANTIAGO DE LUCANAMARCA)",84,110
53,AYACUCHO,"PARINACOCHAS: (PROVINCIA PARINACOCHAS: CORACORA, CHUMPI, CORONEL CASTAÑEDA, PACAPAUSA, PULLO, PUYUSCA, SAN FRANCISCO DE RAVACAYCO, UPAHUACHO / PROVINCIA PAUCAR DEL SARA SARA: PAUSA, COLTA, CORCULLA, LAMPA, MARCABAMBA, OYOLO, PARARCA, SAN JAVIER DE ALPABAMBA, SAN JOSE DE USHUA, SARA SARA )",70,91
54,AYACUCHO,"VILCAS HUAMAN: (PROVINCIA SUCRE: QUEROBAMBA, BELEN, CHALCOS, CHILCAYOC, HUACAÑA, MORCOLLA, PAICO, SAN PEDRO DE LARCAY, SAN SALVADOR DE QUIJE, SANTIAGO DE PAUCARAY, SORAS / PROVINCIA VILCAS HUAMAN: VILCAS HUAMAN, ACCOMARCA, CARHUANCA, CONCEPCION, HUAMBALPA, INDEPENDENCIA, SAURAMA, VISCHONGO )",80,104
55,CAJAMARCA,CAJAMARCA 1: (PROVINCIA CAJAMARCA: CAJAMARCA ),172,224
56,CAJAMARCA,"CAJABAMBA: (PROVINCIA CAJABAMBA: CAJABAMBA, CACHACHI, CONDEBAMBA, SITACOCHA )",100,130
57,CAJAMARCA,"CAJAMARCA 2: (PROVINCIA CAJAMARCA: LOS BAÑOS DEL INCA, ASUNCION, CHETILLA, COSPAN, ENCAÑADA, JESUS, LLACANORA, MAGDALENA, MATARA, NAMORA, SAN JUAN )",192,250
58,CAJAMARCA,"CELENDIN: (PROVINCIA CELENDIN: CELENDIN, CHUMUCH, CORTEGANA, HUASMIN, JORGE CHAVEZ, JOSE GALVEZ, MIGUEL IGLESIAS, OXAMARCA, SOROCHUCO, SUCRE, UTCO, LA LIBERTAD DE PALLAN / PROVINCIA BOLIVAR: BOLIVAR, LONGOTEA, UCHUMARCA, UCUNCHA )",132,172
59,CAJAMARCA,"CHOTA: (PROVINCIA CHOTA: CHOTA, ANGUIA, CHADIN, CHIGUIRIP, CHIMBAN, CHOROPAMPA, COCHABAMBA, CONCHAN, HUAMBOS, LAJAS, LLAMA, MIRACOSTA, PACCHA, PION, QUEROCOTO, SAN JUAN DE LICUPIS, TACABAMBA, TOCMOCHE, CHALAMARCA )",224,292
60,CAJAMARCA,"CONTUMAZA: (PROVINCIA CONTUMAZA: CHILETE, CONTUMAZA, CUPISNIQUE, GUZMANGO, SAN BENITO, SANTA CRUZ DE TOLED, TANTARICA, YONAN )",44,58
61,CAJAMARCA,"CUTERVO: (PROVINCIA CUTERVO: CUTERVO, CALLAYUC, CHOROS, CUJILLO, LA RAMADA, PIMPINGOS, QUEROCOTILLO, SAN ANDRES DE CUTERVO, SAN JUAN DE CUTERVO, SAN LUIS DE LUCMA, SANTA CRUZ, SANTO DOMINGO DE LA CAPILLA, SANTO TOMAS, SOCOTA, TORIBIO CASANOVA )",168,219
62,CAJAMARCA,"HUALGAYOC: (PROVINCIA HUALGAYOC: BAMBAMARCA, CHUGUR, HUALGAYOC )",120,156
63,CAJAMARCA,"JAEN: (PROVINCIA JAEN: JAEN, BELLAVISTA, CHONTALI, COLASAY, HUABAL, LAS PIRIAS, POMAHUACA, PUCARA, SALLIQUE, SAN FELIPE, SAN JOSE DEL ALTO, SANTA ROSA )",204,266
64,CAJAMARCA,"SAN IGNACIO: (PROVINCIA SAN IGNACIO: SAN IGNACIO, CHIRINOS, HUARANGO, LA COIPA, NAMBALLE, SAN JOSE DE LOURDES, TABACONAS )",156,203
65,CAJAMARCA,"SAN MARCOS: (PROVINCIA SAN MARCOS: PEDRO GALVEZ, CHANCAY, EDUARDO VILLANUEVA, GREGORIO PITA, ICHOCAN, JOSE MANUEL QUIROZ, JOSE SABOGAL )",76,99
66,CAJAMARCA,"SAN MIGUEL: (PROVINCIA SAN MIGUEL: SAN MIGUEL, BOLIVAR, CALQUIS, CATILLUC, EL PRADO, LLAPA, NANCHOC, NIEPOS, SAN GREGORIO, SAN SILVESTRE DE COCHAN, TONGOD, UNION AGUA BLANCA )",76,99
67,CAJAMARCA,"SAN PABLO: (PROVINCIA SAN PABLO: SAN PABLO, SAN BERNARDINO, SAN LUIS, TUMBADEN )",36,47
68,CAJAMARCA,"SANTA CRUZ: (PROVINCIA SANTA CRUZ: SANTA CRUZ, ANDABAMBA, CATACHE, CHANCAYBAÑOS, LA ESPERANZA, NINABAMBA, PULAN, SAUCEPAMPA, SEXI, UTICYACU, YAUYUCAN )",52,68
69,CALLAO,"CALLAO 1: (PROVINCIA CALLAO: CALLAO, LA PUNTA )",256,333
70,CALLAO,CALLAO 2: (PROVINCIA CALLAO: VENTANILLA ),196,255
71,CALLAO,CALLAO 3: (PROVINCIA CALLAO: MI PERU ),30,39
72,CALLAO,CALLAO 4: (PROVINCIA CALLAO: CARMEN DE LA LEGUA REYNOSO ),26,34
73,CALLAO,CALLAO 5: (PROVINCIA CALLAO: BELLAVISTA ),46,60
74,CALLAO,CALLAO 6: (PROVINCIA CALLAO: LA PERLA ),38,50
75,CUSCO,"CUSCO 1: (PROVINCIA CUSCO: CUSCO, POROY )",84,110
76,CUSCO,"ACOMAYO: (PROVINCIA ACOMAYO: ACOMAYO, ACOPIA, ACOS, MOSOC LLACTA, POMACANCHI, SANGARARA )",32,42
77,CUSCO,"ANTA: (PROVINCIA ANTA: ANTA, ANCAHUASI, CACHIMAYO, CHINCHAYPUJIO, HUAROCONDO, LIMATAMBO, MOLLEPATA, PUCYURA, ZURITE )",72,94
78,CUSCO,"CALCA: (PROVINCIA CALCA: CALCA, COYA, LAMAY, LARES, PISAC, SAN SALVADOR, TARAY, YANATILE )",80,104
79,CUSCO,"CANAS: (PROVINCIA CANAS: YANAOCA, CHECCA, KUNTURKANKI, LANGUI, LAYO, PAMPAMARCA, QUEHUE, TUPAC AMARU )",64,84
80,CUSCO,"CANCHIS: (PROVINCIA CANCHIS: SICUANI, CHECACUPE, COMBAPATA, MARANGANI, PITUMARCA, SAN PABLO, SAN PEDRO, TINTA )",112,146
81,CUSCO,"CHUMBIVILCAS: (PROVINCIA CHUMBIVILCAS: SANTO TOMAS, CAPACMARCA, CHAMACA, COLQUEMARCA, LIVITACA, LLUSCO, QUIÑOTA, VELILLE )",120,156
82,CUSCO,CUSCO 2: (PROVINCIA CUSCO: WANCHAQ ),44,58
83,CUSCO,CUSCO 3: (PROVINCIA CUSCO: SAN SEBASTIAN ),104,136
84,CUSCO,"CUSCO 4: (PROVINCIA CUSCO: SAN JERONIMO, SAYLLA )",64,84
85,CUSCO,"CUSCO 5: (PROVINCIA CUSCO: SANTIAGO, CCORCA /PROVINCIA ACOMAYO: RONDOCAN / PROVINCIA PARURO: PARURO, ACCHA, CCAPI, COLCHA, HUANOQUITE, OMACHA, PACCARITAMBO, PILLPINTO, YAURISQUE)",116,151
86,CUSCO,"ESPINAR: (PROVINCIA ESPINAR: ESPINAR, CONDOROMA, COPORAQUE, OCORURO, PALLPATA, PICHIGUA, SUYCKUTAMBO, ALTO PICHIGUA )",104,136
87,CUSCO,"LA CONVENCION 1: (PROVINCIA LA CONVENCION: SANTA ANA, ECHARATE, HUAYOPATA, MARANURA, OCOBAMBA, QUELLOUNO, SANTA TERESA, VILCABAMBA, INKAWASI, MEGANTONI )",164,214
88,CUSCO,"LA CONVENCION 2: (PROVINCIA LA CONVENCION: KIMBIRI, PICHARI, VILLA VIRGEN, VILLA KINTIARINA, KUMPIRUSHIATO, CIELO PUNCO, MANITEA, UNION ASHANINKA )",72,94
89,CUSCO,"PAUCARTAMBO: (PROVINCIA PAUCARTAMBO: PAUCARTAMBO, CAICAY, CHALLABAMBA, COLQUEPATA, HUANCARANI, KOSÑIPATA )",60,78
90,CUSCO,"QUISPICANCHI: (PROVINCIA QUISPICANCHI: URCOS, ANDAHUAYLILLAS, CAMANTI, CCARHUAYO, CCATCA, CUSIPATA, HUARO, LUCRE, MARCAPATA, OCONGATE, OROPESA, QUIQUIJANA )",108,141
91,CUSCO,"URUBAMBA: (PROVINCIA URUBAMBA: URUBAMBA, CHINCHERO, HUAYLLABAMBA, MACHUPICCHU, MARAS, OLLANTAYTAMBO, YUCAY )",72,94
92,HUANCAVELICA,"HUANCAVELICA: (PROVINCIA HUANCAVELICA: HUANCAVELICA, ACOBAMBILLA, ACORIA, CONAYCA, CUENCA, HUACHOCOLPA, HUAYLLAHUARA, IZCUCHACA, LARIA, MANTA, MARISCAL CACERES, MOYA, NUEVO OCCORO, PALCA, PILCHACA, VILCA, YAULI, ASCENSION, HUANDO )",148,193
93,HUANCAVELICA,"ACOBAMBA: (PROVINCIA ACOBAMBA: ACOBAMBA, ANDABAMBA, ANTA, CAJA, MARCAS, PAUCARA, POMACOCHA, ROSARIO / PROVINCIA CHURCAMPA: CHURCAMPA, ANCO, CHINCHIHUASI, EL CARMEN, LA MERCED, LOCROJA, PAUCARBAMBA, SAN MIGUEL DE MAYOCC, SAN PEDRO DE CORIS, PACHAMARCA, COSME )",124,161
94,HUANCAVELICA,"ANGARAES: (PROVINCIA ANGARAES: LIRCAY, ANCHONGA, CALLANMARCA, CCOCHACCASA, CHINCHO, CONGALLA, HUANCA-HUANCA, HUAYLLAY GRANDE, JULCAMARCA, SAN ANTONIO DE ANTAPARCO, SANTO TOMAS DE PATA, SECCLLA )",79,103
95,HUANCAVELICA,"CASTROVIRREYNA: (PROVINCIA CASTROVIRREYNA: CASTROVIRREYNA, ARMA, AURAHUA, CAPILLAS, CHUPAMARCA, COCAS, HUACHOS, HUAMATAMBO, MOLLEPAMPA, SAN JUAN, SANTA ANA, TANTARA, TICRAPO )",40,52
96,HUANCAVELICA,"TAYACAJA: (PROVINCIA TAYACAJA: PAMPAS, ACOSTAMBO, ACRAQUIA, AHUAYCHA, COLCABAMBA, DANIEL HERNANDEZ, HUACHOCOLPA, HUARIBAMBA, ÑAHUIMPUQUIO, PAZOS, QUISHUAR, SALCABAMBA, SALCAHUASI, SAN MARCOS DE ROCCHAC, SURCUBAMBA, TINTAY PUNCU, QUICHUAS, ANDAYMARCA, ROBLE, PICHOS, SANTIAGO DE TUCUMA, LAMBRAS, COCHABAMBA )",136,177
97,HUANUCO,"HUANUCO 1: (PROVINCIA HUANUCO: HUANUCO, MARGOS, QUISQUI (KICHKI), SAN PEDRO DE CHAULAN, YARUMAYO, YACUS )",96,125
98,HUANUCO,"AMBO: (PROVINCIA AMBO: AMBO, CAYNA, COLPAS, CONCHAMARCA, HUACAR, SAN FRANCISCO, SAN RAFAEL, TOMAY KICHWA )",76,99
99,HUANUCO,"DOS DE MAYO: (PROVINCIA DOS DE MAYO: LA UNION, CHUQUIS, MARIAS, PACHAS, QUIVILLA, RIPAN, SHUNQUI, SILLAPATA, YANAS )",48,63
100,HUANUCO,"HUAMALIES: (/ PROVINCIA HUAMALIES: LLATA, ARANCAY, CHAVIN DE PARIARCA, JACAS GRANDE, JIRCAN, MIRAFLORES, PUNCHAO, PUÑOS, SINGA, TANTAMAYO / PROVINCIA HUACAYBAMBA: HUACAYBAMBA, CANCHABAMBA, COCHABAMBA, PINRA )",80,104
101,HUANUCO,"HUANUCO 2: (PROVINCIA HUANUCO: SANTA MARIA DEL VALLE, CHINCHAO, CHURUBAMBA, SAN PABLO DE PILLAO )",96,125
102,HUANUCO,"HUANUCO 3: (PROVINCIA HUANUCO: AMARILIS, SAN FRANCISCO DE CAYRAN, PILLCO MARCA )",108,141
103,HUANUCO,"LEONCIO PRADO 1: (PROVINCIA LEONCIO PRADO: RUPA-RUPA, DANIEL ALOMIA ROBLES, HERMILIO VALDIZAN, LUYANDO, MARIANO DAMASO BERAUN, CASTILLO GRANDE, PUEBLO NUEVO, SANTO DOMINGO DE ANDA /PROVINCIA HUAMALIES: MONZON)",128,167
104,HUANUCO,"LEONCIO PRADO 2: (PROVINCIA LEONCIO PRADO: JOSE CRESPO Y CASTILLO, PUCAYACU / PROVINCIA MARAÑON: HUACRACHUCO, SAN BUENAVENTURA, LA MORADA, SANTA ROSA DE ALTO YANAJANCA )",60,78
105,HUANUCO,"PACHITEA: (PROVINCIA PACHITEA: PANAO, CHAGLLA, MOLINO, UMARI )",76,99
106,HUANUCO,"PUERTO INCA: (PROVINCIA PUERTO INCA: CODO DEL POZUZO, PUERTO INCA, HONORIA, TOURNAVISTA, YUYAPICHIS )",52,68
107,HUANUCO,"YAROWILCA: (PROVINCIA YAROWILCA: CHAVINILLO, CAHUAC, CHACABAMBA, APARICIO POMARES, JACAS CHICO, OBAS, PAMPAMARCA, CHORAS /PROVINCIA LAURICOCHA: JESUS, BAÑOS, JIVIA, QUEROPALCA, RONDOS, SAN FRANCISCO DE ASIS, SAN MIGUEL DE CAURI)",84,110
108,ICA,ICA 1: (PROVINCIA ICA: ICA ),116,151
109,ICA,"CHINCHA 1: (PROVINCIA CHINCHA: CHINCHA ALTA, ALTO LARAN, CHINCHA BAJA, EL CARMEN, SAN JUAN DE YANAC, SAN PEDRO DE HUACARPANA, SUNAMPE, TAMBO DE MORA )",112,146
110,ICA,"CHINCHA 2: (PROVINCIA CHINCHA: PUEBLO NUEVO, CHAVIN, GROCIO PRADO )",60,78
111,ICA,"ICA 2: (PROVINCIA ICA: SALAS, SAN JUAN BAUTISTA, SUBTANJALLA )",66,86
112,ICA,"ICA 3: (PROVINCIA ICA: PARCONA, LA TINGUIÑA, SAN JOSE DE LOS MOLINOS / PROVINCIA HUAYTARA: AYAVI, SAN FRANCISCO DE SANGAYAICO, SANTO DOMINGO DE CAPILLAS, TAMBO)",76,99
113,ICA,"ICA 4: (PROVINCIA ICA: SANTIAGO, LOS AQUIJES, OCUCAJE, PACHACUTEC, PUEBLO NUEVO, TATE, YAUCA DEL ROSARIO / PROVINCIA LUCANAS: HUAC-HUAS, LARAMATE, LLAUTA, OCAÑA /PROVINCIA PALPA: PALPA, LLIPATA, RIO GRANDE, SANTA CRUZ, TIBILLO /PROVINCIA HUAYTARA: CORDOVA, LARAMARCA, OCOYO, QUERCO, SAN ISIDRO, SANTIAGO DE CHOCORVOS, SANTIAGO DE QUIRAHUARA)",132,172
114,ICA,"NASCA: ( PROVINCIA NASCA: NASCA, CHANGUILLO, EL INGENIO, MARCONA, VISTA ALEGRE / PROVINCIA LUCANAS: LEONCIO PRADO, OTOCA, SAN PEDRO DE PALCO /)",88,115
115,ICA,"PISCO: ( PROVINCIA PISCO: PISCO, HUANCANO, HUMAY, INDEPENDENCIA, PARACAS, SAN ANDRES, SAN CLEMENTE, TUPAC AMARU INCA /PROVINCIA HUAYTARA: HUAYTARA, HUAYACUNDO ARMA, PILPICHACA, QUITO-ARMA, SAN ANTONIO DE CUSICANCHA)",144,188
116,JUNIN,"HUANCAYO 1: (PROVINCIA HUANCAYO: HUANCAYO, PARIAHUANCA, SANTO DOMINGO DE ACOBAMBA )",100,130
117,JUNIN,"CHANCHAMAYO 1: (PROVINCIA CHANCHAMAYO: CHANCHAMAYO, SAN LUIS DE SHUARO, SAN RAMON, VITOC / PROVINCIA JAUJA: MONOBAMBA )",64,84
118,JUNIN,CHANCHAMAYO 2: (PROVINCIA CHANCHAMAYO: PERENE ),72,94
119,JUNIN,CHANCHAMAYO 3: (PROVINCIA CHANCHAMAYO: PICHANAQUI ),52,68
120,JUNIN,"CHUPACA: (PROVINCIA CHUPACA: CHUPACA, AHUAC, CHONGOS BAJO, HUACHAC, HUAMANCACA CHICO, SAN JUAN DE ISCOS, SAN JUAN DE JARPA, TRES DE DICIEMBRE, YANACANCHA / PROVINCIA CONCEPCION: CHAMBARA, MANZANARES, SAN JOSE DE QUERO )",72,94
121,JUNIN,"CONCEPCION: (PROVINCIA CONCEPCION: CONCEPCION, ACO, ANDAMARCA, COCHAS, COMAS, HEROINAS TOLEDO, MARISCAL CASTILLA, MATAHUASI, MITO, NUEVE DE JULIO, ORCOTUNA, SANTA ROSA DE OCOPA )",56,73
122,JUNIN,HUANCAYO 2: (PROVINCIA HUANCAYO: EL TAMBO ),112,146
123,JUNIN,"HUANCAYO 3: (PROVINCIA HUANCAYO: PILCOMAYO, HUALHUAS, INGENIO, QUICHUAY, QUILCAS, SAN AGUSTIN, SAN JERONIMO DE TUNAN, SAÑO, SICAYA )",76,99
124,JUNIN,HUANCAYO 4: (PROVINCIA HUANCAYO: CHILCA ),60,78
125,JUNIN,"HUANCAYO 5: (PROVINCIA HUANCAYO: SAPALLANGA, CARHUACALLANGA, CHACAPAMPA, CHICCHE, CHONGOS ALTO, CHUPURO, COLCA, CULLHUAS, HUACRAPUQUIO, HUANCAN, HUASICANCHA, HUAYUCACHI, PUCARA, VIQUES )",80,104
126,JUNIN,"JAUJA: (PROVINCIA JAUJA: JAUJA, ACOLLA, APATA, ATAURA, CANCHAYLLO, CURICACA, EL MANTARO, HUAMALI, HUARIPAMPA, HUERTAS, JANJAILLO, JULCAN, LEONOR ORDOÑEZ, LLOCLLAPAMPA, MARCO, MASMA, MASMA CHICCHE, MOLINOS, MUQUI, MUQUIYAUYO, PACA, PACCHA, PANCAN, PARCO, POMACANCHA, RICRAN, SAN LORENZO, SAN PEDRO DE CHUNAN, SAUSA, SINCOS, TUNAN MARCA, YAULI, YAUYOS )",88,115
127,JUNIN,"JUNIN: (PROVINCIA JUNIN: JUNIN, CARHUAMAYO, ONDORES, ULCUMAYO )",40,52
128,JUNIN,"SATIPO 1: (PROVINCIA SATIPO: SATIPO, MAZAMARI, PANGOA, RIO TAMBO, VIZCATAN DEL ENE )",188,245
129,JUNIN,"SATIPO 2: (PROVINCIA SATIPO: RIO NEGRO, COVIRIALI, LLAYLLA, PAMPA HERMOSA )",44,58
130,JUNIN,"TARMA 1: (PROVINCIA TARMA: TARMA, HUARICOLCA )",48,63
131,JUNIN,"TARMA 2: (PROVINCIA TARMA: ACOBAMBA, HUASAHUASI, LA UNION, PALCA, PALCAMAYO, SAN PEDRO DE CAJAS, TAPO )",52,68
132,JUNIN,"YAULI: (PROVINCIA YAULI: LA OROYA, CHACAPALPA, HUAY-HUAY, MOROCOCHA, PACCHA, SANTA ROSA DE SACCO, SUITUCANCHA, YAULI )",36,47
133,LA LIBERTAD,TRUJILLO 1: (PROVINCIA TRUJILLO: TRUJILLO ),192,250
134,LA LIBERTAD,"ASCOPE: (PROVINCIA ASCOPE: CHOCOPE, ASCOPE, CHICAMA, MAGDALENA DE CAO, PAIJAN, RAZURI, SANTIAGO DE CAO, CASA GRANDE )",100,130
135,LA LIBERTAD,"CHEPEN: (PROVINCIA CHEPEN: CHEPEN, PACANGA, PUEBLO NUEVO )",78,102
136,LA LIBERTAD,"GRAN CHIMU: (PROVINCIA GRAN CHIMU: CASCAS, LUCMA, MARMOT, SAYAPULLO )",40,52
137,LA LIBERTAD,"JULCAN: (PROVINCIA JULCAN: JULCAN, CALAMARCA, CARABAMBA, HUASO )",42,55
138,LA LIBERTAD,"OTUZCO: (PROVINCIA OTUZCO: OTUZCO, AGALLPAMPA, CHARAT, HUARANCHAL, MACHE, SALPO, USQUIL )",106,138
139,LA LIBERTAD,"PACASMAYO: (PROVINCIA PACASMAYO: PACASMAYO, SAN PEDRO DE LLOC, GUADALUPE, JEQUETEPEQUE, SAN JOSE )",94,122
140,LA LIBERTAD,"PATAZ: (PROVINCIA PATAZ: TAYABAMBA, BULDIBUYO, CHILLIA, HUANCASPATA, HUAYLILLAS, HUAYO, ONGON, PARCOY, PATAZ, PIAS, SANTIAGO DE CHALLAS, TAURIJA, URPAY )",106,138
141,LA LIBERTAD,"SANCHEZ CARRION: (PROVINCIA SANCHEZ CARRION: HUAMACHUCO, CHUGAY, COCHORCO, CURGOS, MARCABAL, SANAGORAN, SARIN, SARTIMBAMBA /PROVINCIA BOLIVAR: BAMBAMARCA, CONDORMARCA)",182,237
142,LA LIBERTAD,"SANTIAGO DE CHUCO: (PROVINCIA SANTIAGO DE CHUCO: SANTIAGO DE CHUCO, ANGASMARCA, CACHICADAN, MOLLEBAMBA, MOLLEPATA, QUIRUVILCA, SANTA CRUZ DE CHUCA, SITABAMBA )",66,86
143,LA LIBERTAD,TRUJILLO 2: (PROVINCIA TRUJILLO: LA ESPERANZA ),106,138
144,LA LIBERTAD,"TRUJILLO 3: (PROVINCIA TRUJILLO: HUANCHACO, ALTO TRUJILLO )",120,156
145,LA LIBERTAD,"TRUJILLO 4: (PROVINCIA TRUJILLO: EL PORVENIR, FLORENCIA DE MORA )",90,117
146,LA LIBERTAD,"TRUJILLO 5: (PROVINCIA TRUJILLO: VICTOR LARCO HERRERA, MOCHE, SALAVERRY )",106,138
147,LA LIBERTAD,"TRUJILLO 6: (PROVINCIA TRUJILLO: LAREDO, POROTO, SIMBAL / PROVINCIA OTUZCO: LA CUESTA, PARANDAY, SINSICAP)",66,86
148,LA LIBERTAD,"VIRU: (PROVINCIA VIRU: VIRU, CHAO, GUADALUPITO )",102,133
149,LAMBAYEQUE,CHICLAYO 1: (PROVINCIA CHICLAYO: CHICLAYO ),172,224
150,LAMBAYEQUE,CHICLAYO 2: (PROVINCIA CHICLAYO: JOSE LEONARDO ORTIZ ),102,133
151,LAMBAYEQUE,CHICLAYO 3: (PROVINCIA CHICLAYO: PIMENTEL ),40,52
152,LAMBAYEQUE,"CHICLAYO 4: (PROVINCIA CHICLAYO: LA VICTORIA, MONSEFU, SANTA ROSA )",96,125
153,LAMBAYEQUE,"CHICLAYO 5: (PROVINCIA CHICLAYO: CAYALTI, ETEN, ETEN PUERTO, LAGUNAS, NUEVA ARICA, OYOTUN, REQUE, SAÑA, PUCALA )",84,110
154,LAMBAYEQUE,"CHICLAYO 6: (PROVINCIA CHICLAYO: TUMAN, CHONGOYAPE, PICSI, PATAPO, POMALCA / PROVINCIA SAN MIGUEL: LA FLORIDA )",88,115
155,LAMBAYEQUE,"FERREÑAFE: (PROVINCIA FERREÑAFE: FERREÑAFE, CAÑARIS, INCAHUASI, MANUEL ANTONIO MESONES MURO, PITIPO, PUEBLO NUEVO )",108,141
156,LAMBAYEQUE,"LAMBAYEQUE 1: (PROVINCIA LAMBAYEQUE: LAMBAYEQUE, MOCHUMI, SAN JOSE )",92,120
157,LAMBAYEQUE,"LAMBAYEQUE 2: (PROVINCIA LAMBAYEQUE: MORROPE, ILLIMO, TUCUME )",68,89
158,LAMBAYEQUE,"LAMBAYEQUE 3: (PROVINCIA LAMBAYEQUE: OLMOS, PACORA )",64,84
159,LAMBAYEQUE,"LAMBAYEQUE 4: (PROVINCIA LAMBAYEQUE: MOTUPE, CHOCHOPE, JAYANCA, SALAS )",76,99
160,LIMA METROPOLITANA,LIMA CENTRO 1_BREÑA: (PROVINCIA LIMA: BREÑA ),64,83
161,LIMA METROPOLITANA,LIMA CENTRO 1_LIMA: (PROVINCIA LIMA: LIMA ),192,250
162,LIMA METROPOLITANA,LIMA CENTRO 1_RIMAC: (PROVINCIA LIMA: RIMAC ),123,160
163,LIMA METROPOLITANA,LIMA CENTRO 2_MAGDALENA DEL MAR: (PROVINCIA LIMA: MAGDALENA DEL MAR ),56,73
164,LIMA METROPOLITANA,LIMA CENTRO 2_MIRAFLORES: (PROVINCIA LIMA: MIRAFLORES ),112,146
165,LIMA METROPOLITANA,LIMA CENTRO 2_PUEBLO LIBRE: (PROVINCIA LIMA: PUEBLO LIBRE ),68,89
166,LIMA METROPOLITANA,LIMA CENTRO 2_SAN ISIDRO: (PROVINCIA LIMA: SAN ISIDRO ),64,84
167,LIMA METROPOLITANA,LIMA CENTRO 2_SAN MIGUEL: (PROVINCIA LIMA: SAN MIGUEL ),116,151
168,LIMA METROPOLITANA,LIMA CENTRO 3_JESUS MARIA: (PROVINCIA LIMA: JESUS MARIA ),76,99
169,LIMA METROPOLITANA,LIMA CENTRO 3_LA VICTORIA: (PROVINCIA LIMA: LA VICTORIA ),124,162
170,LIMA METROPOLITANA,LIMA CENTRO 3_LINCE: (PROVINCIA LIMA: LINCE ),52,68
171,LIMA METROPOLITANA,LIMA CENTRO 3_SAN BORJA: (PROVINCIA LIMA: SAN BORJA ),80,104
172,LIMA METROPOLITANA,LIMA CENTRO 3_SAN LUIS: (PROVINCIA LIMA: SAN LUIS ),40,52
173,LIMA METROPOLITANA,LIMA ESTE 1_SAN JUAN DE LURIGANCHO: (PROVINCIA LIMA: SAN JUAN DE LURIGANCHO),740,962
174,LIMA METROPOLITANA,LIMA ESTE 2_CIENEGUILLA: (PROVINCIA LIMA: CIENEGUILLA ),48,63
175,LIMA METROPOLITANA,LIMA ESTE 2_EL AGUSTINO: (PROVINCIA LIMA: EL AGUSTINO ),136,177
176,LIMA METROPOLITANA,LIMA ESTE 2_LA MOLINA: (PROVINCIA LIMA: LA MOLINA ),96,125
177,LIMA METROPOLITANA,LIMA ESTE 2_SANTA ANITA: (PROVINCIA LIMA: SANTA ANITA ),132,172
178,LIMA METROPOLITANA,LIMA ESTE 3_ATE: (PROVINCIA LIMA: ATE ),440,572
179,LIMA METROPOLITANA,LIMA ESTE 4_CHACLACAYO: (PROVINCIA LIMA: CHACLACAYO ),28,37
180,LIMA METROPOLITANA,LIMA ESTE 4_LURIGANCHO: (PROVINCIA LIMA: LURIGANCHO ),220,286
181,LIMA METROPOLITANA,LIMA NORTE 1_ANCON: (PROVINCIA LIMA: ANCON ),64,84
182,LIMA METROPOLITANA,LIMA NORTE 1_PUENTE PIEDRA: (PROVINCIA LIMA: PUENTE PIEDRA ),240,312
